{
  "$schema": "../_schema/case.schema.json",
  "id": "beauty-d2c-voc",
  "title": {
    "ko": "Beauty/D2C 글로벌 VOC → 업무 제안",
    "en": "Beauty/D2C global VOC → workflow proposal"
  },
  "type": "workflow",
  "primary_domain": "customer-revenue",
  "industry": "consumer-retail",
  "difficulty": 1,
  "capabilities": [
    "workflow-discovery",
    "retrieval-analysis",
    "human-approval",
    "evaluation"
  ],
  "recommended_after": [],
  "learning_order": 2,
  "status": "ready",
  "evidence_stage": "public-simulation",
  "readiness": [
    "low",
    "saas"
  ],
  "risk": "moderate",
  "entry_channels": [
    "Public review data"
  ],
  "systems": [
    "Public VOC sources",
    "Analysis workspace",
    "Work-management sandbox"
  ],
  "current_write_impact": "none",
  "designed_write_impact": "approved-sandbox-write",
  "current_autonomy": "A1-A2",
  "designed_autonomy": "A1-A3",
  "implemented_project_stages": [
    1,
    2
  ],
  "designed_project_stages": [
    1,
    2,
    3,
    5
  ],
  "verified_at": "2026-10-26",
  "owner": "AX Engineer Roadmap maintainers",
  "limitations": [
    "Public data may not represent internal VOC composition.",
    "No live organizational adoption or business outcome has been verified.",
    "P1 independent review by a non-implementer has not been recorded yet.",
    "P2 approval decisions are replayed synthetic events, not actions by real approvers.",
    "The rules-versus-model comparison required by P1 has not been run."
  ]
}
