{
  "$schema": "../_schema/case.schema.json",
  "id": "slack-meeting-actions",
  "title": {
    "ko": "Slack 회의 기록에서 승인할 후속 업무 찾기",
    "en": "Identifying Follow-up Actions for Approval from Slack Meeting Records"
  },
  "type": "workflow",
  "primary_domain": "people-collaboration",
  "industry": "cross-industry",
  "difficulty": 2,
  "capabilities": [
    "saas-integration",
    "human-approval",
    "audit",
    "recovery"
  ],
  "recommended_after": [
    "file-csv-to-ax-hub"
  ],
  "learning_order": 4,
  "status": "ready",
  "evidence_stage": "simulation-design",
  "readiness": [
    "saas",
    "it"
  ],
  "risk": "moderate",
  "entry_channels": [
    "Slack"
  ],
  "systems": [
    "Slack",
    "Notion",
    "Google Workspace",
    "monday.com",
    "Workflow execution ledger"
  ],
  "current_write_impact": "none",
  "designed_write_impact": "approved-sandbox-write",
  "current_autonomy": "A0",
  "designed_autonomy": "A1-A3",
  "implemented_project_stages": [],
  "designed_project_stages": [
    1,
    2,
    3,
    4,
    5
  ],
  "verified_at": "2026-07-27",
  "owner": "AX Engineer Roadmap maintainers",
  "limitations": [
    "Simulation design only; no production deployment or organizational outcome is claimed.",
    "Only explicitly approved actions may be written to an isolated monday.com sandbox.",
    "Source permissions, API limits, and team-specific approval rules must be validated locally."
  ]
}
