{
  "$schema": "../_schema/case.schema.json",
  "id": "company-agent-operating-layer",
  "title": {
    "ko": "여러 업무를 위한 에이전트 운영 기반",
    "en": "Shared Agent Operations Foundation"
  },
  "type": "organizational-capstone",
  "primary_domain": "shared-operations",
  "industry": "cross-industry",
  "difficulty": 5,
  "capabilities": [
    "saas-integration",
    "identity-access",
    "human-approval",
    "observability",
    "audit",
    "recovery",
    "reuse-governance"
  ],
  "recommended_after": [
    "slack-meeting-actions",
    "centralized-mail-assist"
  ],
  "learning_order": 15,
  "status": "ready",
  "evidence_stage": "simulation-design",
  "readiness": [
    "saas",
    "it"
  ],
  "risk": "high",
  "entry_channels": [
    "Slack",
    "Microsoft Teams"
  ],
  "systems": [
    "Workflow source SaaS",
    "Policy and approval broker",
    "Agent runtime adapters",
    "Audit and observability store"
  ],
  "current_write_impact": "none",
  "designed_write_impact": "mixed",
  "current_autonomy": "A0",
  "designed_autonomy": "A1-A3",
  "implemented_project_stages": [],
  "designed_project_stages": [
    2,
    3,
    4,
    5
  ],
  "verified_at": "2026-07-27",
  "owner": "AX Engineer Roadmap maintainers",
  "limitations": [
    "Reuse in a second live workflow has not been verified.",
    "No production deployment, runtime comparison, enterprise readiness, security-control effectiveness, or organizational outcome has been verified."
  ]
}
