{
  "$schema": "../_schema/case.schema.json",
  "id": "centralized-mail-assist",
  "title": {
    "ko": "여러 업무가 함께 쓰는 메일 보조",
    "en": "Shared Mail Assistance Across Workflows"
  },
  "type": "shared-integration",
  "primary_domain": "shared-operations",
  "industry": "cross-industry",
  "difficulty": 4,
  "capabilities": [
    "saas-integration",
    "human-approval",
    "identity-access",
    "audit",
    "recovery"
  ],
  "recommended_after": [
    "slack-meeting-actions"
  ],
  "learning_order": 8,
  "status": "ready",
  "evidence_stage": "simulation-design",
  "readiness": [
    "saas",
    "it"
  ],
  "risk": "high",
  "entry_channels": [
    "Email",
    "Slack"
  ],
  "systems": [
    "Mail connector",
    "Shared inbox",
    "Slack",
    "Audit store"
  ],
  "current_write_impact": "none",
  "designed_write_impact": "approved-sandbox-write",
  "current_autonomy": "A0",
  "designed_autonomy": "A1-A3",
  "implemented_project_stages": [],
  "designed_project_stages": [
    1,
    2,
    3,
    4,
    5
  ],
  "verified_at": "2026-07-27",
  "owner": "AX Engineer Roadmap maintainers",
  "limitations": [
    "The design has not been connected to a live organizational mailbox.",
    "No user adoption, operating reliability, security-control effectiveness, or business outcome has been verified."
  ]
}
